{
  "abreviaciones": {
    "archivo": "v1/abreviaciones.json",
    "hash": "sha256:152df09052a957cc8abd3ffb32a9424f951af825c51a8daef8adc5a55b2b965f"
  },
  "actualizado": "2026-09-20",
  "contrato": "1.0.0",
  "horarios": [
    {
      "archivo": "v1/horarios/2026-2C.json",
      "desde": "2026-07-26",
      "hash": "sha256:ddac1d18658b45b18661f9026784c20c528d1bb33d494c8667699aa3f82935f4",
      "hasta": "2026-12-31",
      "periodo": "2026-2C",
      "publicado": "2026-09-20"
    }
  ],
  "horarios_esperados": {
    "2027-1C": "2026-11"
  },
  "planes": [
    {
      "archivo": "v1/planes/S10-Rev23.json",
      "hash": "sha256:3461e52089252ccb37a16b2d49c54b70c99c8afa1f7bb35b251344ec91b40582",
      "plan": "S10-Rev23"
    }
  ],
  "vocabulario": {
    "archivo": "v1/vocabulario.json",
    "hash": "sha256:4fa023f69537888e80ee5850b211f43acb7c9f7b112b6e88fc3c00fb9b864580"
  }
}
